ris_type,type,paper_id,title,date,abstract,volume,isbn,pages,url,journal
JOUR,article,769,How Much Control of Tuberculosis?,1937-01-01,"Frost, W H",27,0002-9572 (Print),759-66,http://www.ncbi.nlm.nih.gov/pubmed/18014673,Am J Public Health Nations Health
JOUR,article,760,How much control of tuberculosis: 1937-1957-1977,1957-01-01,"FELDMANN, F M",47,0002-9572 (Print),1235-41,http://www.ncbi.nlm.nih.gov/pubmed/13458543,Am J Public Health Nations Health
JOUR,article,972,An estimation of the scope for BCG vaccination in preventing tuberculosis among those aged 15–19 years in England and Wales at the present time,1959-01-01,"The second report of the Medical Research Council trial of tuberculosis vaccines in adolescents (Medical Research Council, 1959) contained an estimate of the benefit to be expected from BCG vaccination. If all those tuberculin-negative on entry to the trial in 1950–52, at the age of 14 years, had been vaccinated with BCG, the reduction in the incidence of tuberculosis in the ensuing five years would have been 59 per cent.The present study, by taking into account the recent decrease in risk of exposure to tuberculous infection in England and Wales, provides similar estimates of the scope for BCG vaccination, which are more up to date and also applicable to the whole country.Of the tuberculosis notifications among those aged 15–19 years in England and Wales in 1958, it is estimated that 52 per cent could have been prevented by BCG vaccination at the age of 14 years of all who were then tuberculin-negative. This estimate for 1958 is compared with that for 1953, which was 60 per cent. There has thus been a moderate decline in the scope for BCG vaccination during these five years. If the trend in exposure to tuberculous infection continues, BCG vaccination of all tuberculin-negative children who are aged 14 years now (1959) would apparently reduce the incidence when they become 15–19 years of age by rather less than half.In terms of the numbers of cases preventable by BCG vaccination of children aged 14 years, the scope has declined very considerably, from about 2,950 notifications among those aged 15–19 years in 1953, to 1,400 in the same age group in 1958. We may in a few years reach a situation in this country in which mass vaccination of older school children prevents only small numbers of cases of tuberculosis in adolescents. If, however, the protection from vaccination is maintained, cases will also be prevented in those aged 20 years and over.It is estimated that the official scheme for BCG vaccination at the age of 13 years, which started at the end of 1953, reduced the numbers of notifications at ages 15–19 years in England and Wales by 50 in 1956, 156 in 1957 and 241 in 1958. These small numbers are due to incomplete coverage of the 15–19 year age group in these years and the slow development of the scheme.It is suggested that a central bureau should be established to collect and interpret the information in connexion with the official vaccination scheme. This could make a valuable contribution to the eradication of tuberculosis from this country. ",40,NA,413-24,http://www.sciencedirect.com/science/article/pii/S0041387959800969,Tubercle and Lung Disease
JOUR,article,1002,The use of mathematical models in the study of the epidemiology of tuberculosis,1962-01-01,"WAALER, H",52,0002-9572 (Print),1002-13,http://www.ncbi.nlm.nih.gov/pubmed/14004185,Am J Public Health Nations Health
JOUR,article,971,Mathematical approach to the study of tuberculin sensitivity,1965-01-01,"TY - JOUR TB Transmission, pathogenesis, and epidemiology Infection with tubercle bacilli Descript epi: infection TBN testing - interpretation",12,NA,101-110,NA,Indian J Tuberc
JOUR,article,677,Systems analysis in tuberculosis control: a model,1967-01-01,"Brogger, S",95,0003-0805 (Print),419-34,http://www.ncbi.nlm.nih.gov/pubmed/6018702,Am Rev Respir Dis
JOUR,article,764,An epidemiological model of tuberculosis in the United States,1967-01-01,"IN FILE TB Transmission, pathogenesis, and epidemiology Infection with tubercle bacilli Predict epi of morbidity: prospects for the epidemic",53,NA,4-7,file://C:\literature_pdf\rm14754.pdf,Nat.Tuberc.Assoc.Bull.
JOUR,article,821,"[Prognostication of the epidemiological situation of tuberculosis, based on an epidemiological model (Preliminary report)]",1967-01-01,"Juchniewicz, M Olakowski, T Mardon, K Poland Gruzlica i choroby pluc; tuberculosis et pneumonologia Gruzlica. 1967;35(10):961-7.",35,0017-4955 (Print) 0017-4955 (Linking),961-967,http://www.ncbi.nlm.nih.gov/entrez/query.fcgi?cmd=Retrieve&db=PubMed&dopt=Citation&list_uids=5582655,Gruzlica i Choroby Pluc
JOUR,article,923,Mathematical models for the economic allocation of tuberculosis control activities in developing nations,1967-01-01,"The regional management of tuberculosis in developing nations is studied utilizing the tools of systems analysis. A tuberculosis system is visualized, the system being made up of components which are the epidemiological categories that characterize the disease. The interaction of these components determines the future state of the disease. Controls in the form of therapy, vaccinations, or prophylaxis may be superimposed on the natural processes, thus altering the future course of the disease. A descriptive mathematical model describing the flows between the various categories can be used to predict the trends both with and without intervention. An optimization model is derived from the descriptive model under the assumption that a program of reproduction of active cases has been specified. The optimization model would be used to select the forms of control which achieve the specified reduction program at least cost. Optimization is accomplished via linear programming.",96,0003-0805 (Print),893-909,NA,Am Rev Respir Dis
JOUR,article,1004,Cost-benefit analysis of BCG-vaccination under various epidemiological situations,1968-01-01,"Waaler, H T",41,0074-9249 (Print),42-52,http://www.ncbi.nlm.nih.gov/pubmed/5710260,Bull Int Union Tuberc
JOUR,article,1005,A dynamic model for the epidemiology of tuberculosis,1968-01-01,"TY - JOUR TB Transmission, pathogenesis, and epidemiology Tuberculosis Predict epi of morbidity: prospects for the epidemic",98,NA,591-600,Printout in Models Box 1 (In EndNote no PDF),American Review of Respiratory Disease
BILL,misc,782,[A statistical model for evaluating the activity of minor forms of pulmonary tuberculosis],1969-01-01,NA,47,NA,59-64,http://www.ncbi.nlm.nih.gov/entrez/query.fcgi?db=pubmed&cmd=Retrieve&dopt=AbstractPlus&list_uids=4904991,Probl Tuberk
JOUR,article,970,The transmission of tubercle bacilli - its trend in a human population. Tuberculosis Surveillance Research Unit Report No. 1,1969-01-01,"TY - JOUR TB Transmission, pathogenesis, and epidemiology Infection with tubercle bacilli Etiol epi: risk of infection Risk of infection - models L1 - file://C:\literature_pdf\rm00302.pdf",42,NA,1-104,NA,NA
JOUR,article,1008,The use of an epidemiological model for estimating the effectiveness of tuberculosis control measures. Sensitivity of the effectiveness of tuberculosis control measures to the coverage of the population,1969-01-01,"Given an adequate definition of the disease problem in epidemiological terms, it is possible to measure the epidemiological effectiveness of control measures in terms of problem reduction. This is to be distinguished from the clinical efficacy of the same measures. The practical difficulty in assessing the epidemiological effectiveness of control measures experimentally can be overcome by the construction of simulation models and the use of computers, whereby the problem reduction associated with various control strategies can be estimated numerically.By varying the levels of certain parameters of the model systematically, the sensitivity of the effectiveness of control measures to the epidemiological, operational, clinical and social parameters of a situation can be assessed. A series of articles analysing this relationship is under preparation. This first article analyses the sensitivity of the effectiveness of BCG vaccination and of the chemotherapy of tuberculosis to changes in the coverage of the eligible population groups. A previously formulated postulate stating that the marginal effectiveness of these measures decreases as their coverage increases is validated by this first series of simulations. The significance of this finding for planning national tuberculosis control strategies is discussed, as well as possible bias in the method applied.",41,0042-9686 (Print),75-93,http://www.ncbi.nlm.nih.gov/pubmed/5309169,Bull World Health Organ
JOUR,article,922,A mathematical model for determining case finding and treatment activities in tuberculosis control programs,1970-01-01,"Revelle, C",102,0003-0805 (Print),403-11,NA,Am Rev Respir Dis
JOUR,article,1006,Model simulation and decision-making in tuberculosis programmes,1970-01-01,"Waaler, H T",43,0074-9249 (Print),337-44,NA,Bull Int Union Tuberc
JOUR,article,1009,Use of an epidemiological model for estimating the effectiveness of tuberculosis control measures. Sensitivity of the effectiveness of tuberculosis control measures to the social time preference,1970-01-01,"Different combinations of coverage levels of BCG vaccination and of case-finding and treatment may achieve the same problem reduction in epidemiological terms. But the same problem reduction, in man-years of tuberculosis, may be valued differently in social terms.A social-time-preference parameter, of the form 1/(1+r)(t), is relevant to this evaluation and the level of r is critical for policy decision. The present paper studies the sensitivity of the effectiveness of BCG vaccination and of case-finding and treatment to the level of r, and the epidemiological mechanism underlying such sensitivity. A high value of r can be visualized as corresponding to a close planning horizon, a lower value of r to a more distant one. At any level of epidemiological effectiveness, a planner with a high value of r would favour case-finding and treatment, and a planner with a low value of r would tend to emphasize BCG vaccination. This influence of the social-time-preference parameter on the planner's decision is found to depend on the discounting effect of the parameter on the one hand, and on the different age- and time-patterns of the preventive effect of the major control measures, on the other.",43,0042-9686 (Print),1-16,NA,Bull World Health Organ
JOUR,article,694,Planning models for tuberculosis control programs,1971-01-01,NA,6,NA,144,http://pubmedcentralcanada.ca/picrender.cgi?accid=PMC1067333&blobtype=pdf,Health Services Research
JOUR,article,752,[Estimation of future epidemiological trends of tuberculosis in Japan and the evaluation of tuberculosis control programmes by simulation analysis],1971-01-01,Journal Article Japan [Tuberculosis],46,0022-9776 (Print),99-111,http://www.ncbi.nlm.nih.gov/entrez/query.fcgi?cmd=Retrieve&db=PubMed&dopt=Citation&list_uids=5572852,Kekkaku
JOUR,article,973,The effect of tuberculin reversion upon the estimate of the annual risk of tuberculous infection. Tuberculosis Surveillance Research Unit Report No. 2,1971-01-01,"TY - JOUR TB Transmission, pathogenesis, and epidemiology Infection with tubercle bacilli Predict epi: risk of infection Risk of infection - models L1 - file://C:\literature_pdf\rm04516.pdf",45,NA,115-118,NA,NA
BILL,misc,685,Endogenous reactivation and exogenous reinfection: their relative importance with regard to the development of non-primary tuberculosis,1972-01-01,NA,47,NA,116-34,http://www.ncbi.nlm.nih.gov/sites/entrez?Db=pubmed&Cmd=Retrieve&list_uids=5077111&dopt=abstractplus,Bull Int Union Tuberc
BILL,misc,822,[Mathematical model of pulmonary tuberculosis and its treatment by lowering the partial pressure of oxygen],1972-01-01,NA,205,NA,1237-9,http://www.ncbi.nlm.nih.gov/entrez/query.fcgi?db=pubmed&cmd=Retrieve&dopt=AbstractPlus&list_uids=5086128,Dokl Akad Nauk SSSR
BILL,misc,681,[Mathematical model in tuberculosis],1973-01-01,NA,22,NA,561-84,http://www.ncbi.nlm.nih.gov/entrez/query.fcgi?db=pubmed&cmd=Retrieve&dopt=AbstractPlus&list_uids=4775093,Ftiziologia
JOUR,article,809,"Disease, cure, and death: epidemiologic and clinical parameters for chronic diseases illustrated by a model - tuberculosis",1973-01-01,"TY - JOUR TB Transmission, pathogenesis, and epidemiology Tuberculosis Predict epi of morbidity:prospects for the epidemic",97,NA,148-159,NA,NA
JOUR,article,848,Evolution of the rates of tuberculous infection in France and calculation of the annual risk by means of a mathematical model,1973-01-01,"TY - JOUR TB Transmission, pathogenesis, and epidemiology Infection with tubercle bacilli Predict epi: risk of infection Risk of infection - models",2,NA,265-282,NA,Int J Epidemiol
JOUR,article,933,[A Markovian model in tuberculosis epidemiology],1973-01-01,"Owing to the wide range of tuberculo statics, the treatment of tuberculosis",22,NA,585-92,http://www.ncbi.nlm.nih.gov/entrez/query.fcgi?db=pubmed&cmd=Retrieve&dopt=AbstractPlus&list_uids=4775094,Ftiziologia
JOUR,article,720,Annual risk of tuberculosis infection in the Transkei. Problems connected with its estimation from the data of a tuberculin survey,1974-01-01,"IN FILE TB Transmission, pathogenesis, and epidemiology Tuberculosis Descript epi: morbidity Africa - South Africa",48,NA,957-960,file://C:\literature_pdf\rm09596.pdf,S Afr Med J
JOUR,article,1003,[BCG vaccination policies as a function of the epidemiological situation],1974-01-01,"Waaler, H",49,0074-9249 (Print),181-206,http://www.ncbi.nlm.nih.gov/pubmed/4467941,Bull Int Union Tuberc
JOUR,article,1007,Tuberculosis in rural South India. A study of possible trends and the potential impact of antituberculosis programmes,1974-01-01,"Data on the dynamics of the tuberculosis situation in rural South India, obtained by the National Tuberculosis Institute, Bangalore, were fed into a mathematical model. By this means predictions about the future tuberculosis situation have been made under a wide range of hypothetical assumptions.",51,0042-9686 (Print),263-71,http://www.ncbi.nlm.nih.gov/pubmed/4549350,Bull World Health Organ
JOUR,article,638,A simple simulation model of tuberculosis epidemiology for use without large-scale computers,1975-01-01,"A large-scale computer service is not always available in many countries with tuberculosis problems needing epidemiological analysis. To facilitate work in such countries, a simple epidemiological model was made to calculate annual trends in the prevalence and incidence of tuberculosis and its infection, in tuberculosis mortality, and in BCG coverage, using average parameter values not specific for age groups or birth year cohorts. To test its approximation capabilities and limits, the model was applied to epidemiological data from Japan, where sufficient information was available from repeated nation-wide sample surveys and national statistics. The approximation was found to be satisfactory within certain limits. The model is best used with a desk-top computer, but the calculations can be performed with a small calculator or even by hand.",52,0042-9686 (Print),313-22,http://www.ncbi.nlm.nih.gov/pubmed/1084802,Bull World Health Organ
JOUR,article,639,"[Estimation of the epidemiological time trend of tuberculosis in Japan, a trial with a simple epidemiological simulation model (author's transl)]",1975-01-01,"Azuma, Y JAPAN Kekkaku. 1975 Jul;50(7):199-207.",50,0022-9776 (Print) 0022-9776 (Linking),199-207,http://www.ncbi.nlm.nih.gov/pubmed/1185919,Kekkaku
JOUR,article,932,A method for estimating the prevalence of tuberculosis infection,1975-01-01,"The prevalence of tuberculous infection in a population is generally estimated from calculating the proportion of tested individuals who react with at least 10 mm of induration to 5 TU of PPD-S tuberculin. Reactions due to infection with atypical mycobacteria, however, may cause the prevalence to be overestimated. This paper is concerned with an alternative method of estimating the prevalence of infection with Mycobacterium tuberculosis. The method utilizes population distributions of reaction size by dividing study populations into two groups--individuals with and without known exposure to tuberculosis. The mathematical model developed here removes the effect of atypical infections and provides a truer picture of tuberculous infection. Data from a Navy recruit population demonstrate the use of the model with the result that among recruits with no known exposure to tuberculosis, the estimated prevalence is reduced by about one-half. Among recuits with known exposure to tuberculosis, there is essentially no difference between the two methods. Important advantages in using this method are that probabilities of true infection by induration size are generated, and that itis less sensitive to variations caused by differences in reading techniques and in tuberculin potencies. Furthermore, it is applicable to other diseases if the underlying assumptions are met.",101,0002-9262 (Print),311-22,http://aje.oxfordjournals.org.ez.lshtm.ac.uk/content/101/4/311.full.pdf,Am J Epidemiol
JOUR,article,975,The association of the risk of tuberculous infection with age,1975-01-01,"TY - JOUR TB Transmission, pathogenesis, and epidemiology Infection with tubercle bacilli Predict epi: risk of infection Risk of infection - models L1 - file://C:\literature_pdf\rm04519.pdf",50,NA,70-81,NA,Bull.Int.Union Tuberc.
JOUR,article,1001,The risk of tuberculous infection in Norway. Tuberculosis Surveillance Research Unitn Report No. 3,1975-01-01,"TY - JOUR TB Transmission, pathogenesis, and epidemiology Infection with tubercle bacilli Predict epi: risk of infection Risk of infection - models L1 - file://C:\literature_pdf\rm04517.pdf",50,NA,5-61,NA,NA
JOUR,article,692,Maximizing health system output with political and administrative constraints using mathematical programming,1976-01-01,"Decisions about delivery programs to improve health status are characterized by indivisibilities or ""lumpiness,"" interdependencies between case types with varying health output, high fixed costs, administrative constraints, and qualitative quity and political considerations. The nature of the constraints and the goal of health services strongly suggest a mathematical programming model to maximize a comprehensive measure of health status. In a previously unreported development, binary integer programming can be extended to consider shared fixed costs, a widespread problem in optimizing effectiveness measures such as health status. The model proposed here applies conceptually across all target populations and health programs and could be used to optimize the output of a total health system. The effects of such optimization would be appropriately reflected in the weighted life expectancy computed as a social indicator.",13,0046-9580 (Print),215-27,NA,Inquiry
JOUR,article,919,Estimation of number of repeat examinations required to detect all tuberculosis cases in the community,1976-01-01,"TB Diagnosis of tuberculosis Laboratory diagnosis Specimen collection, transport and decontamination Specimen - collection",20,NA,118-121,file://C:\literature_pdf\rm13026.pdf,Indian Journal of Public Health
JOUR,article,974,"Recent studies in the epidemiology of tuberculosis, based on the risk of being infected with tubercle bacilli",1976-01-01,"TY - JOUR TB Transmission, pathogenesis, and epidemiology Infection with tubercle bacilli Etiol epi: risk of infection Risk of infection - models L1 - file://C:\literature_pdf\rm00296.pdf",19,NA,1-63,NA,Advances in Tuberculosis Research
JOUR,article,976,Alternative models for the development of tuberculosis disease following infection with tubercle bacilli,1976-01-01,"Sutherland, I",51,0074-9249 (Print),171-9,http://www.ncbi.nlm.nih.gov/pubmed/1030279,Bull Int Union Tuberc
JOUR,article,889,A simple model for planning and assessment of programmes for tuberculosis control,1977-01-01,"Nair, S S Comparative Study India Indian journal of public health Indian J Public Health. 1977 Jul-Sep;21(3):111-31.",21,0019-557X (Print) 0019-557X (Linking),111-131,http://www.ncbi.nlm.nih.gov/entrez/query.fcgi?cmd=Retrieve&db=PubMed&dopt=Citation&list_uids=615153file://C:\literature_pdf\rm00731.pdf,Indian Journal of Public Health
BILL,misc,633,[Application of a mathematical model for choosing the best combination of instruments for the detection and treatment of pulmonary tuberculosis],1978-01-01,NA,12,NA,455-70,http://www.ncbi.nlm.nih.gov/entrez/query.fcgi?db=pubmed&cmd=Retrieve&dopt=AbstractPlus&list_uids=752918,Rev Saude Publica
JOUR,article,968,Tuberculosis: generation effects and chemotherapy,1978-01-01,"TY - JOUR TB Transmission, pathogenesis, and epidemiology Tuberculosis deaths Descript epi: mortality Mortality - cohort studies",107,NA,120-126,NA,NA
JOUR,article,959,A simulation model of tuberculosis epidemiology adaptability to Indian conditions,1979-01-01,NA,26,NA,4-10,Print out in Chris's box,Indian J Tuberc
JOUR,article,872,Cost effectiveness calculations for the diagnosis and treatment of tuberculous meningitis,1980-01-01,"This study illustrates how cost-effectiveness calculations provide help in decisions involving a choice between introduction of a new diagnostic procedure or a new therapy for a particular clinical problem. This type of problem is critical for areas where financial resources are limiting. Our analysis is centered on the value of diagnosis and treatment in tuberculous meningitis (Tbm) and, because of its importance to developing countries, our epidemiologic data were derived from India. When financial costs are ignored, the introduction of second line therapy (e.g., Rifampin) leads to more cures than does the introduction of even a perfect diagnostic test. However, diagnostic tests (e.g., the Bromide partition test or possibly radioassays) markedly improve case finding and to some extent increase cure rates. All affects vary markedly with the prevalence of tuberculous meningitis in the population under study. For example, net financial savings would occur were a perfect nuclear test available and conventional therapy used at a prevalence of Tbm of 30% whereas there would be a net loss if the prevalence rose to 80%. This study underscores the need for detailed studies on the radiobromide partition test and for the development of new diagnostic tests, perhaps a radioimmunoassay of either the acid fast bacillus or of an antibody to it.",5,0340-6997 (Print),271-6,NA,Eur J Nucl Med
JOUR,article,708,The contribution of medical measures to the decline of mortality from respiratory tuberculosis: an age-period-cohort model,1982-01-01,"TY - JOUR TB Transmission, pathogenesis, and epidemiology Tuberculosis deaths Descript epi: mortality Mortality - cohort studies",19,NA,409-427,NA,Demography
BILL,misc,879,[Use of a mathematical model for evaluation of tuberculosis case-finding with mass miniature radiography (author's transl)],1982-01-01,NA,57,NA,47-57,http://www.ncbi.nlm.nih.gov/entrez/query.fcgi?db=pubmed&cmd=Retrieve&dopt=AbstractPlus&list_uids=6803059,Kekkaku
