ris_type,type,paper_id,title,date,abstract,volume,isbn,pages,url,journal
JOUR,article,767,Cost-effectiveness of alternative strategies for tuberculosis screening before kindergarten entry,2007-01-01,"OBJECTIVE: We undertook a decision analysis to evaluate the economic and health effects and incremental cost-effectiveness of using targeted tuberculin skin testing, compared with universal screening or no screening, before kindergarten. METHODS: We constructed a decision tree to determine the costs and clinical outcomes of using targeted testing compared with universal screening or no screening. Baseline estimates for input parameters were taken from the medical literature and from California health jurisdiction data. Sensitivity analyses were performed to determine plausible ranges of associated outcomes and costs. We surveyed California health jurisdictions to determine the prevalence of mandatory universal tuberculin skin testing. RESULTS: In our base-case scenario, the cost to prevent an additional case of tuberculosis by using targeted testing, compared with no screening, was $524,897. The cost to prevent an additional case by using universal screening, compared with targeted testing, was $671,398. The incremental cost of preventing a case through screening remained above $100,000 unless the prevalence of tuberculin skin testing positivity increased to >10%. More than 51% of children entering kindergarten in California live where tuberculin skin testing is mandatory. CONCLUSIONS: The cost to prevent a case of tuberculosis by using either universal screening or targeted testing of kindergarteners is high. If targeted testing replaced universal tuberculin skin testing in California, then $1.27 million savings per year would be generated for more cost-effective strategies to prevent tuberculosis. Improving the positive predictive value of the risk factor tool or applying it to groups with higher prevalence of latent tuberculosis would make its use more cost-effective. Universal tuberculin skin testing should be discontinued, and targeted testing should be considered only when the prevalence of risk factor positivity and the prevalence of tuberculin skin testing positivity among risk factor-positive individuals are high enough to meet acceptable thresholds for cost-effectiveness.",120,1098-4275 (Electronic),90-9,http://pediatrics.aappublications.org/content/120/1/90.full.pdf,Pediatrics
JOUR,article,783,Implications of partial immunity on the prospects for tuberculosis control by post-exposure interventions,2007-01-01,"One-third of the world population (approximately 2 billion individuals) is currently infected with Mycobacterium tuberculosis, the vast majority harboring a latent infection. As the risk of reactivation is around 10% in a lifetime, it follows that 200 million of these will eventually develop active pulmonary disease. Only therapeutic or post-exposure interventions can tame this vast reservoir of infection. Treatment of latent infections can reduce the risk of reactivation, and there is accumulating evidence that combination with post-exposure vaccines can reduce the risk of reinfection. Here we develop mathematical models to explore the potential of these post-exposure interventions to control tuberculosis on a global scale. Intensive programs targeting recent infections appear generally effective, but the benefit is potentially greater in intermediate prevalence scenarios. Extending these strategies to longer-term persistent infections appears more beneficial where prevalence is low. Finally, we consider that susceptibility to reinfection is altered by therapy, and explore its epidemiological consequences. When we assume that therapy reduces susceptibility to subsequent reinfection, catastrophic dynamics are observed. Thus, a bipolar outcome is obtained, where either small or large reductions in prevalence levels result, depending on the rate of detection and treatment of latent infections. By contrast, increased susceptibility after therapy may induce an increase in disease prevalence and does not lead to catastrophic dynamics. These potential outcomes are silent unless a widespread intervention is implemented.",248,0022-5193 (Print),608-17,http://ac.els-cdn.com/S0022519307002846/1-s2.0-S0022519307002846-main.pdf?_tid=5839d379ca81b25a7b73afd9055a8d60&acdnat=1345012345_79ffbc04fe99446b4f36cf19900f8c40,J Theor Biol
JOUR,article,793,Isoniazid bactericidal activity and resistance emergence: integrating pharmacodynamics and pharmacogenomics to predict efficacy in different ethnic populations,2007-01-01,"Isoniazid, administered as part of combination antituberculosis therapy, is responsible for most of the early bactericidal activity (EBA) of the regimen. However, the emergence of Mycobacterium tuberculosis resistance to isoniazid is a major problem. We examined the relationship between isoniazid exposure and M. tuberculosis microbial kill, as well as the emergence of resistance, in our in vitro pharmacodynamic model of tuberculosis. Since single-nucleotide polymorphisms of the N-acetyltransferase-2 gene lead to two different clearances of isoniazid from serum in patients, we simulated the isoniazid concentration-time profiles encountered in both slow and fast acetylators. Both microbial kill and the emergence of resistance during monotherapy were associated with the ratio of the area under the isoniazid concentration-time curve from 0 to 24 h (AUC(0-24)) to the isoniazid MIC. The time in mutant selection window hypothesis was rejected. Next, we utilized the in vitro relationship between the isoniazid AUC(0-24)/MIC ratio and microbial kill, the distributions of isoniazid clearance in populations with different percentages of slow and fast acetylators, and the distribution of isoniazid MICs for isonazid-susceptible M. tuberculosis clinical isolates in Monte Carlo simulations to calculate the EBA expected for approximately 10,000 patients treated with 300 mg of isoniazid. For those patient populations in which the proportion of fast acetylators and the isoniazid MICs were high, the average EBA of the standard dose was approximately 0.3 log(10) CFU/ml/day and was thus suboptimal. Our approach, which utilizes preclinical pharmacodynamics and the genetically determined multimodal distributions of serum clearances, is a preclinical tool that may be able to predict the EBAs of various doses of new antituberculosis drugs.",51,0066-4804 (Print),2329-36,http://aac.asm.org/content/51/7/2329.full.pdf,Antimicrob Agents Chemother
BILL,misc,804,Early detection of tuberculosis outbreaks among the San Francisco homeless: trade-offs between spatial resolution and temporal scale,2007-01-01,"BACKGROUND: San Francisco has the highest rate of tuberculosis (TB) in the U.S. with recurrent outbreaks among the homeless and marginally housed. It has been shown for syndromic data that when exact geographic coordinates of individual patients are used as the spatial base for outbreak detection, higher detection rates and accuracy are achieved compared to when data are aggregated into administrative regions such as zip codes and census tracts. We examine the effect of varying the spatial resolution in the TB data within the San Francisco homeless population on detection sensitivity, timeliness, and the amount of historical data needed to achieve better performance measures. METHODS AND FINDINGS: We apply a variation of space-time permutation scan statistic to the TB data in which a patient's location is either represented by its exact coordinates or by the centroid of its census tract. We show that the detection sensitivity and timeliness of the method generally improve when exact locations are used to identify real TB outbreaks. When outbreaks are simulated, while the detection timeliness is consistently improved when exact coordinates are used, the detection sensitivity varies depending on the size of the spatial scanning window and the number of tracts in which cases are simulated. Finally, we show that when exact locations are used, smaller amount of historical data is required for training the model. CONCLUSION: Systematic characterization of the spatio-temporal distribution of TB cases can widely benefit real time surveillance and guide public health investigations of TB outbreaks as to what level of spatial resolution results in improved detection sensitivity and timeliness. Trading higher spatial resolution for better performance is ultimately a tradeoff between maintaining patient confidentiality and improving public health when sharing data. Understanding such tradeoffs is critical to managing the complex interplay between public policy and public health. This study is a step forward in this direction.",2,NA,e1284,http://www.plosone.org/article/info%3Adoi%2F10.1371%2Fjournal.pone.0001284,PLoS One
JOUR,article,826,Costs and cost-effectiveness of adolescent compliance with treatment for latent tuberculosis infection: results from a randomized trial,2007-01-01,"PURPOSE: Assess the costs and cost-effectiveness of an incentive-based tuberculosis (TB) program designed to promote adolescents' compliance with treatment for latent TB infection (LTBI). METHODS: Randomized controlled trial. Adolescents between the ages of 11 and 19 years who were referred to one of two participating clinics after being screened for TB and receiving a positive diagnosis indicating LTBI (n = 794) were assigned to one of four groups: usual care, peer counseling, contingency contracting, and combined peer counseling/contingency contracting. Primary outcome variables were completion of isoniazid preventive therapy (IPT), total treatment costs, and lifetime TB-related costs per quality-adjusted life year (QALY) in each of the four study groups (three treatment, one control). Cost effectiveness was evaluated using a five-stage Markov model and a Monte Carlo simulation with 10,000 trials. RESULTS: Average costs were 199 dollars for usual care (UC), 277 dollars for peer counseling (PC), 326 dollars for contingency contracting (CC), and 341 dollars for PC + CC combined. The differences among these groups were all significant at the p = .001 level. Only the PC + CC group improved the rate of IPT completion (83.8%) relative to usual care (75.9%) (p = .051), with an overall incremental CE ratio of 209 dollars per QALY relative to usual care. CONCLUSION: Incentives combined with peer counseling are a cost-effective strategy for helping adolescents to complete care when combined with peer counseling.",40,1879-1972 (Electronic),61-8,http://ac.els-cdn.com/S1054139X06003089/1-s2.0-S1054139X06003089-main.pdf?_tid=90d79c56-f1d4-11e1-a0a1-00000aab0f01&acdnat=1346243286_cc1761d7767c3933366d4866b5dee7d3,J Adolesc Health
JOUR,article,857,Planning to improve global health: the next decade of tuberculosis control,2007-01-01,"The Global Plan to Stop TB 2006-2015 is a road map for policy-makers and managers of national programmes. It sets out the key actions needed to achieve the targets of the Millennium Development Goals relating to tuberculosis (T13): to halve the prevalence and deaths by 2015 relative to 1990 levels and to save 14 million lives. Developed by a broad coalition of partners, the plan presents a model approach combining interventions that can feasibly be supplied on the ground. The main areas of activity set out in the plan are: scaling up interventions to control tuberculosis; promoting the research and development of improved diagnostics, drugs and vaccines; and engaging in related activities for advocacy, communications and social mobilization.",85,0042-9686,341-347,<Go to ISI>://000246790400008,Bulletin of the World Health Organization
JOUR,article,604,"Cost-utility of tuberculosis prevention among HIV-infected adults in Kampala, Uganda",2007-01-01,TB Periodical,11,NA,747-754,file://C:\literature_pdf\rm17660.pdf,International Journal of Tuberculosis and Lung Disease
JOUR,article,958,Sequential Monte Carlo without likelihoods,2007-01-01,"Recent new methods in Bayesian simulation have provided ways of evaluating posterior distributions in the presence of analytically or computationally intractable likelihood functions. Despite representing a substantial methodological advance, existing methods based on rejection sampling or Markov chain Monte Carlo can be highly inefficient and accordingly require far more iterations than may be practical to implement. Here we propose a sequential Monte Carlo sampler that convincingly overcomes these inefficiencies. We demonstrate its implementation through an epidemiological study of the transmission rate of tuberculosis.",104,0027-8424 (Print),1760-5,http://www.pnas.org/content/104/6/1760.full.pdf,Proceedings of the National Academy of Sciences of the USA
BILL,misc,965,Tuberculosis in intra-urban settings: a Bayesian approach,2007-01-01,"OBJECTIVE: To model the effect of socio-economic deprivation and a few transmission-related indicators of the tuberculosis (TB) incidence at small area level, to discuss the potential of each indicator in targeting places for developing preventive action. METHODS: Ecological spatial study of TB incidence in Olinda, a city in the north-east of Brazil, during the period 1996-2000. Three socio-economic indicators (mean number of inhabitants per household; percentage of heads of household with <1 year's formal education; percentage of heads of households with monthly income lower than the minimum wage) and two transmission-related indicators (number of cases of retreatment; number of households with more than one case during the period under study), all calculated per census tract, were used. We adopted four different full hierarchical Bayesian models to estimate the relative risk of the occurrence of TB via Markov chain Monte Carlo. RESULTS: The best specified model includes all the selected covariates and the spatially structured random effect. The gain in goodness-of-fit statistic when the spatial structure was included confirms the clustered spatial pattern of disease and poverty. In this model, the covariates within the non-zero credibility interval were the number of persons per house, the number of cases of retreatment and the number of households with more than one case (all with relative risk > or = 1.8) in each census tract. CONCLUSIONS: The possibility to estimate in the same framework both the contribution of covariates at ecological level and the spatial pattern should be encouraged in epidemiology, and may help with establishing Epidemiological Surveillance Systems on a territorial basis, that allows rational planning of interventions and improvement of the Control Programme effectiveness.",12,NA,323-30,http://www3.interscience.wiley.com/journal/118506949/abstract,Trop Med Int Health
JOUR,article,969,Diabetes and tuberculosis: the impact of the diabetes epidemic on tuberculosis incidence,2007-01-01,"Background: Tuberculosis ( TB) remains a major cause of mortality in developing countries, and in these countries diabetes prevalence is increasing rapidly. Diabetes increases the risk of TB. Our aim was to assess the potential impact of diabetes as a risk factor for incident pulmonary tuberculosis, using India as an example.",7,1471-2458,NA,<Go to ISI>://000250030800001,BMC Public Health
JOUR,article,1273,A threshold value for the time delay to TB diagnosis,2007-01-01,"BACKGROUND: In many communities where TB occurs at high incidence, the major force driving the epidemic is transmission. It is plausible that the typical long delay from the onset of infectious disease to diagnosis and commencement of treatment is almost certainly the major factor contributing to the high rate of transmission. METHODOLOGY/PRINCIPAL FINDINGS: This study is confined to communities which are epidemiologically relatively isolated and which have low HIV incidence. The consequences of delays to diagnosis are analyzed and the existence of a threshold delay value is demonstrated. It is shown that unless a sufficient number of cases are detected before this threshold, the epidemic will escalate. The method used for the analysis avoids the standard computer integration of systems of differential equations since the intention is to present a line of reasoning that reveals the essential dynamics of an epidemic in an intuitively clear way that is nevertheless quantitatively realistic. CONCLUSIONS/SIGNIFICANCE: The analysis presented here shows that typical delays to diagnosis present a major obstacle to the control of a TB epidemic. Control can be achieved by optimizing the rapid identification of TB cases together with measures to increase the threshold value. A calculated and aggressive program is therefore necessary in order to bring about a reduction in the prevalence of TB in a community by decreasing the time to diagnosis in all its ramifications. Intervention strategies to increase the threshold value relative to the time to diagnosis and which thereby decrease disease incidence are discussed.",2,1932-6203 (Electronic),e757,http://www.ncbi.nlm.nih.gov/pubmed/17712405,PLoS One
JOUR,article,619,"Cost-effectiveness analysis of introduction of rapid, alternative methods to identify multidrug-resistant tuberculosis in middle-income countries",2008-01-01,"BACKGROUND: Resistance to commonly used antituberculosis drugs is emerging worldwide. Conventional drug-susceptibility testing (DST) methods are slow and demanding. Alternative, rapid DST methods would permit the early detection of drug resistance and, in turn, arrest tuberculosis transmission. METHODS: A cost-effectiveness analysis of 5 DST methods was performed in the context of a clinical trial that compared rapid with conventional DST methods. The methods under investigation were direct phage-replication assay (FASTPlaque-Response; Biotech), direct amplification and reverse hybridization of the rpoB gene (INNO-LiPA; Innogenetics), indirect colorimetric minimum inhibitory concentration assay (MTT; ICN Biomedicals), and direct proportion method on Lowenstein-Jensen medium. These were compared with the widely used indirect proportion method on Lowenstein-Jensen medium. RESULTS: All alternative DST methods were found to be cost-effective, compared with other health care interventions. DST methods also generate substantial cost savings in settings of high prevalence of multidrug-resistant tuberculosis. Excluding the effects of transmission, the direct proportion method on Lowenstein-Jensen medium was the most cost-effective alternative DST method for patient groups with prevalences of multidrug-resistant tuberculosis of 2%, 5%, 20%, and 50% (cost in US$2004, $94, $36, $8, and $2 per disability-adjusted life year, respectively). CONCLUSION: Alternative, rapid methods for DST are cost-effective and should be considered for use by national tuberculosis programs in middle-income countries.",47,1537-6591 (Electronic) 1058-4838 (Linking),487-95,http://www.ncbi.nlm.nih.gov/entrez/query.fcgi?cmd=Retrieve&db=PubMed&dopt=Citation&list_uids=18636955http://www.journals.uchicago.edu/doi/pdf/10.1086/590010,Clin Infect Dis
JOUR,article,544,Modeling the joint epidemics of TB and HIV in a South African township,2008-01-01,"We present a simple mathematical model with six compartments for the interaction between HIV and TB epidemics. Using data from a township near Cape Town, South Africa, where the prevalence of HIV is above 20% and where the TB notification rate is close to 2,000 per 100,000 per year, we estimate some of the model parameters and study how various control measures might change the course of these epidemics. Condom promotion, increased TB detection and TB preventive therapy have a clear positive effect. The impact of antiretroviral therapy on the incidence of HIV is unclear and depends on the extent to which it reduces sexual transmission. However, our analysis suggests that it will greatly reduce the TB notification rate.",57,0303-6812 (Print),557-93,http://www.ncbi.nlm.nih.gov/entrez/query.fcgi?cmd=Retrieve&db=PubMed&dopt=Citation&list_uids=18414866,J Math Biol
JOUR,article,551,The theoretical influence of immunity between strain groups on the progression of drug-resistant tuberculosis epidemics,2008-01-01,"BACKGROUND: Emerging research suggests that genetically distinct strains of Mycobacterium tuberculosis may modulate the immune system differently. This may be of importance in high-burden settings where > or =1 genetic group of M. tuberculosis confers significant morbidity. METHODS: A dynamic mathematical model was constructed to evaluate how different degrees of cross-immunity among M. tuberculosis groups could affect epidemics of drug-resistant tuberculosis (TB). RESULTS: Simulated populations with immunogenically distinct TB strain groups experienced a heightened risk of drug-resistant TB, compared with populations without such strain diversity, even when the same rates of case detection and treatment success were achieved. The highest risks of infection were observed in populations in which HIV was prevalent. Drug-resistant strains with very low transmission fitness could still propagate in environments with reduced cross-immunity among different strain groups, even after common targets for case detection and treatment success are reached. CONCLUSIONS: It is possible that the propagation of drug-resistant strains could depend not only on the rate of development of resistance and the fitness of the drug-resistant strains but, also, on the diversity of the strains in the region. The risk of infection with drug-resistant strains could be amplified in locations where there is reduced cross-immunity between originating strain groups. This amplification may be most profound during the first few decades of TB treatment expansion.",198,0022-1899 (Print),1502-13,http://jid.oxfordjournals.org/content/198/10/1502.full.pdf,J Infect Dis
JOUR,article,658,Modelling the effects of pre-exposure and post-exposure vaccines in tuberculosis control,2008-01-01,"Epidemic control strategies alter the spread of the disease in the host population. In this paper, we describe and discuss mathematical models that can be used to explore the potential of pre-exposure and post-exposure vaccines currently under development in the control of tuberculosis. A model with bacille Calmette-Guerin (BCG) vaccination for the susceptibles and treatment for the infectives is first presented. The epidemic thresholds known as the basic reproduction numbers and equilibria for the models are determined and stabilities are investigated. The reproduction numbers for the models are compared to assess the impact of the vaccines currently under development. The centre manifold theory is used to show the existence of backward bifurcation when the associated reproduction number is less than unity and that the unique endemic equilibrium is locally asymptotically stable when the associated reproduction number is greater than unity. From the study we conclude that the pre-exposure vaccine currently under development coupled with chemoprophylaxis for the latently infected and treatment of infectives is more effective when compared to the post-exposure vaccine currently under development for the latently infected coupled with treatment of the infectives.",254,1095-8541 (Electronic),633-49,http://ac.els-cdn.com/S0022519308003093/1-s2.0-S0022519308003093-main.pdf?_tid=9cd3afbb621724c7f1c7b776db347970&acdnat=1345011996_6faf58a30be5ee9615d3855da6ebe4a6,J Theor Biol
JOUR,article,659,Tuberculosis transmission model with chemoprophylaxis and treatment,2008-01-01,"A tuberculosis model which incorporates treatment of infectives and chemoprophylaxis is presented. The model assumes that latently infected individuals develop active disease as a result of endogenous re-activation, exogenous re-infection and disease relapse, though a small fraction is assumed to develop active disease soon after infection. We start by formulating and analyzing a TB model without any intervention strategy that we extend to incorporate chemoprophylaxis and treatment of infectives. The epidemic thresholds known as reproduction numbers and equilibria for the models are determined, and stabilities analyzed. The reproduction numbers for the models are compared to assess the possible community benefits achieved by treatment of infectives, chemoprophylaxis and a holistic approach of these intervention strategies. The study shows that treatment of infectives is more effective in the first years of implementation (approximately 10 years) as treatment results in clearing active TB immediately and there after chemoprophylaxis will do better in controlling the number of infectives due to reduced progression to active TB.",70,0092-8240 (Print),1163-91,http://www.springerlink.com/content/f553q1508h5073g8/,Bull Math Biol
