ris_type,type,paper_id,title,date,abstract,volume,isbn,pages,url,journal
JOUR,article,981,The dynamics of repeated elements: applications to the epidemiology of tuberculosis,2000-01-01,"We propose a stepwise mutation model to describe the dynamics of DNA fingerprint variation in Mycobacterium tuberculosis. The genome of M. tuberculosis carries insertion sequences (IS6110) that are relatively stable over time periods of months but have an observable transposition rate over longer time scales. Variability in copy number and genomic location of (IS6110) can be harnessed to generate a DNA fingerprint for each strain, by digesting the genome with a restriction enzyme and using a portion of the element as a probe for Southern blots. The number of bands found for a given genome approximates the number of copies of IS6110 it carries. A large data set of such fingerprints from tuberculosis (TB) cases in San Francisco provides an observed distribution of IS6110 copy number. Implementation of the model through deterministic and stochastic simulation indicates some general features of IS/TB dynamics. By comparing observations with outcomes of the model, we conclude that the IS/TB system is very heterogeneous and far from equilibrium. We find that the transposition parameters have a much stronger effect than the epidemic parameters on copy number distribution.",97,NA,3532-3537,http://www.ncbi.nlm.nih.gov/entrez/query.fcgi?cmd=Retrieve&db=PubMed&dopt=Citation&list_uids=10716736,Proceedings of the National Academy of Sciences of the USA
JOUR,article,982,The cost-effectiveness of screening for latent tuberculosis infection,2000-01-01,TY - JOUR TB Periodical,4(suppl 2),NA,S127-S133,NA,International Journal of Tuberculosis and Lung Disease
JOUR,article,999,"Lifetime risks, incubation period, and serial interval of tuberculosis",2000-01-01,"The lifetime risk of developing disease, the incubation period, and the time period between infection and transmission (the serial interval) are three important measures for interpreting trends in tuberculous infection and disease but are complicated by strong age dependencies regarding disease risk and by the potential for reinfection to occur. By using a model of the epidemiology of tuberculosis in England and Wales, the authors demonstrated that all three measures changed dramatically during the 20th century largely as a result of declines in the risk of infection. The estimated lifetime risk was highest following infection in early adulthood and declined with year of infection; the age-weighted average was approximately 12% during the last 50 years. Incubation period distributions depend on whether they are viewed prospectively (from infection to disease onset) or retrospectively (since infection for cases with disease onset at a particular time). As children rarely develop infectious forms of tuberculosis, infections acquired in childhood are associated with considerably longer serial intervals than those acquired in adulthood. These unusual properties are probably shared by other infections with long intervals between infection and disease. The results are important for interpreting data on transmission patterns, as are now being derived from molecular epidemiologic studies.",152,0002-9262 (Print),247-63,http://www.ncbi.nlm.nih.gov/pubmed/10933272,Am J Epidemiol
JOUR,article,662,Modeling the economic benefits of better TB vaccines,2001-01-01,"OBJECTIVE: To describe the economic benefits of a better tuberculosis (TB) vaccine by modeling prevented TB medical spending and lost productivity throughout the world. DESIGN: One model is based on benefits obtained from reducing the impact of TB on health spending. An alternative model is based on minimizing the impact of TB on health spending and lost productivity due to death and disability. Both models are applied to various world populations based on secondary data. RESULTS: In terms of avoided medical spending, preventing 100% of the TB risk in a single individual is estimated to be worth from $38 for males in formerly socialist countries to S0.23 for children in Asia. More than 1 billion people would reckon their expected medical savings to exceed $25.00 if they received a 75% effective vaccine of 10 years' duration. Preventing lost productivity is worth substantially more throughout the world. CONCLUSIONS: Improved TB vaccines would be of substantial immediate financial value to most of the populations of the world, including the poorest. The scientific uncertainties surrounding the development of a better vaccine could be a larger obstacle than investor uncertainty over whether a vaccine would be profitable.",5,1027-3719 (Print),984-93,NA,International Journal of Tuberculosis and Lung Disease
JOUR,article,671,Transmission of Mycobacterium tuberculosis depending on the age and sex of source cases,2001-01-01,"This study estimated to what extent tuberculosis transmission in the Netherlands depends on the age and sex of source cases. DNA fingerprints of Mycobacterium tuberculosis isolates were matched to patient information in the Netherlands Tuberculosis Register for 1993-1998. Clusters were defined as groups of patients with pulmonary tuberculosis whose isolates had identical DNA fingerprints. Source cases were assigned by using two models. The first-case model assumed that the first diagnosed case was the source case. The incidence rate model estimated source case probabilities from the incidence rates of potential source cases and the time of diagnosis. DNA fingerprints of 6,102 isolates were matched to patient information on 5,080 (83%) cases, 3,479 of whom had pulmonary disease. According to both models, the number of infectious cases generated per source case was lower for female than for male source cases and decreased with increasing age of the source case. The authors concluded that transmission of tuberculosis is associated with the age and sex of source cases as well as the age of secondary cases. Increased transmission among immigrant groups in the Netherlands is largely attributable to the relatively young age of immigrant source cases.",154,0002-9262 (Print),934-43,http://www.ncbi.nlm.nih.gov/pubmed/11700248,Am J Epidemiol
JOUR,article,676,Strategies to decrease tuberculosis in us homeless populations: a computer simulation model,2001-01-01,"CONTEXT: The rate of tuberculosis (TB) among US homeless persons may be 20 times that of the general adult population. Studies suggest that the majority of urban homeless TB cases are attributable to ongoing transmission of TB. Optimal TB-control strategies in both chronically and transiently homeless populations are not known. OBJECTIVE: To examine the effects of TB-control strategies on projected TB cases and deaths in US homeless populations using a computer-based simulation model. DESIGN, SETTING, AND POPULATION: The US general population and a theoretical population of 2 million homeless individuals in 1995 were divided into 18 clinical states based on the risk for or presence of TB and human immunodeficiency virus (HIV) infection in a semi-Markov model. MAIN OUTCOME MEASURES: Prevalence of transiently and chronically homeless individuals with active TB and deaths from TB as a function of public health measures taken to control and eliminate TB, including improvement of treatment effectiveness, improvement in access to treatment, and vaccination with BCG. RESULTS: A 10% increase in access to treatment among homeless persons with active TB produced larger declines in predicted TB cases and deaths after 10 years (cases and deaths among chronically homeless persons decreased 12.5% and 19.8% and among transiently homeless persons dropped 35.9% and 32.4%, respectively) than improvements in the effectiveness of treatment programs (cases and deaths among chronically homeless persons declined 7.2% and 3.1% and among transiently homeless persons dropped 10.9% and 4.1%, respectively). A 10% increase in access to treatment among homeless persons with latent TB infection led to a 6.7% decline in TB among chronically homeless persons and a 5.7% decline among transiently homeless persons, while a 10% improvement in effectiveness of treatment for latent TB infection was associated with declines of 3.0% and 3.3%, respectively. When treatment for latent TB infection was modeled to be the same in vaccinated and nonvaccinated populations, BCG vaccination led to TB case declines of 15.4% and 21.5% in chronically and transiently homeless populations, respectively. CONCLUSIONS: Overcoming barriers faced by homeless individuals in accessing TB treatment programs will be crucial to reducing the burden of TB in this high-risk group. Increased treatment access, improvement in the effectiveness of treatment programs, and BCG vaccination of HIV-negative homeless individuals have the best chance to markedly decrease TB morbidity and mortality.",286,0098-7484 (Print),834-42,http://jama.jamanetwork.com/article.aspx?articleid=194096,JAMA
JOUR,article,741,Will tuberculosis become resistant to all antibiotics?,2001-01-01,"The discovery of high prevalences of antibiotic resistance in some pathogens, in some parts of the world, has provoked fears of a widespread loss of drug efficacy. Here, we use a mathematical model to investigate the evolution of resistance to four major anti-tuberculosis drugs (isoniazid, rifampicin, ethambutol and streptomycin) in 47 sites around the world. The model provides a new method of estimating the relative risk of treatment failure for patients carrying drug-resistant strains and the proportion of patients who develop resistance after failing treatment. Using estimates of these two quantities together with other published data, we reconstructed the epidemic spread of isoniazid resistance over the past 50 years. The predicted median prevalence of resistance among new cases today was 7.0% (range 0.9-64.3%), close to the 6.3% (range 0-28.1%) observed. Predicted and observed prevalences of resistance to isoniazid plus rifampicin (multidrug-resistant or MDR-TB) after 30 years of combined drug use were also similar, 0.9% (0.1-5.9%) and 1.0% (range 0-14.1%), respectively. With current data, and under prevailing treatment practices, it appears that MDR-TB will remain a localized problem, rather than becoming a global obstacle to tuberculosis control. To substantiate this result, further measurements are needed of the relative fitness of drug-resistant strains.",268,0962-8452 (Print),45-52,http://rspb.royalsocietypublishing.org.ez.lshtm.ac.uk/content/268/1462/45.full.pdf,Proc Biol Sci
JOUR,article,762,On the role of variable latent periods in mathematical models for tuberculosis,2001-01-01,NA,13,NA,425-452,NA,Journal of Dynamics and Differential equations
JOUR,article,819,Miniature chest radiograph screening for tuberculosis in jails. A cost-effectiveness analysis,2001-01-01,TY - JOUR TB Tuberculosis control Case-finding No sub-heading,164,NA,77-81,NA,NA
JOUR,article,824,Estimation of tuberculosis risk and incidence under upper room ultraviolet germicidal irradiation in a waiting room in a hypothetical scenario,2001-01-01,"Environmental control measures (ventilation, high-efficiency particulate air filtration, and upper room ultraviolet germicidal irradiation [UVGI]) are recommended to effectively control tuberculosis (TB) transmission from unsuspected TB patients in high-risk settings, but the effectiveness of their use is not often clear. This study presents a simulation model for a hypothetical hospital waiting room, in which the number of susceptible immunocompetent people in the waiting room follows a Poisson distribution (M = 5) in either low (annual number of TB patients = 5) or high TB risk settings (annual number of TB patients = 50), and used the model to evaluate the reduction of TB transmission risk by upper room UVGI. An exponential dose-response model was used for TB transmission and a two-zone model was used for evaluating the effect of upper room UVGI. Upper room UVGI reduced TB risk by 1.6-fold at 3 microW/cm2 UV irradiance in the upper room in the low TB risk setting and by 4.1-fold at 15 microW/cm2 UV irradiance in the upper room in the high TB risk setting. Use of upper room UVGI also reduced the mean annual new infection rate from 2.2 to 1.3 infections per year at 3 microW/cm2 and to 0.6 infections per year at 15 microW/cm2 in our hypothetical high-risk settings. The effect of upper room UVGI was sensitive to both vertical air velocity (air mixing) and UV irradiance level. Results from partitioning variability indicate that most variability of TB transmission risk came from waiting time in our hypothetical hospital.",21,0272-4332 (Print),657-73,NA,Risk Anal
JOUR,article,907,Cost-effectiveness of tuberculosis screening and observed preventive therapy for active drug injectors at a syringe-exchange program,2001-01-01,"This study examined whether costs associated with tuberculosis (TB) screening and directly observed preventive therapy (DOPT) among drug injectors attending a syringe exchange are justified by cases and costs of active TB cases prevented and examined the impact of monetary incentives to promote adherence on cost-effectiveness. We examined program costs and projected savings using observed adherence and prevalence rates and literature estimates of isoniazid (INH) preventive therapy efficacy, expected INH hepatoxicity rates, and TB treatment costs; we conducted sensitivity analyses for a range of INH effectiveness, chest X-ray (CXR) referral adherence, and different strategies regarding anergy among persons affected with human immunodeficiency virus (HIV). For 1,000 patients offered screening, incorporating real observed program adherence rates, the program would avert $179,934 in TB treatment costs, for a net savings of $123,081. Assuming a modest risk of TB among HIV-infected anergic persons, all strategies with regard to anergy were cost saving, and the strategy of not screening for anergy and not providing DOPT to HIV-infected anergic persons resulted in the greatest cost savings. If an incentive of $25 per person increased CXR adherence from the observed 31% to 50% or 100%, over a 5-year follow-up the net cost savings would increase to $170,054 and $414,856, respectively. In this model, TB screening and DOPT at a syringe exchange is a cost-effective intervention and is cost-saving compared to costs of treating active TB cases that would have occurred in the absence of the intervention. This model is useful in evaluating the cost impact of planned program refinements, which can then be tested. Monetary incentives for those referred for screening CXRs would be justified on a cost basis if they had even a modest beneficial impact on adherence.",78,1099-3460 (Print) 1099-3460 (Linking),550-67,http://www.ncbi.nlm.nih.gov/entrez/query.fcgi?cmd=Retrieve&db=PubMed&dopt=Citation&list_uids=11564856,J Urban Health
JOUR,article,592,Amplification dynamics: predicting the effect of HIV on tuberculosis outbreaks,2001-01-01,"HIV affects the pathogenesis and the transmission of Mycobacterium tuberculosis. We used a discrete event simulation model to predict the potential impact of HIV on increasing the probability and the expected severity of tuberculosis outbreaks. Our predictions reveal that an HIV epidemic can significantly increase the frequency and severity of tuberculosis outbreaks, but that this amplification effect of HIV on tuberculosis outbreaks is very sensitive to the tuberculosis treatment rate. At moderate or low treatment rates, even a moderate HIV epidemic can cause the average size of tuberculosis outbreaks to almost double in comparison with the expected outbreak size when HIV is absent. However, we determined that the amplification effect of HIV can be substantially reduced if the treatment rate of tuberculosis is very high. We discuss the significant implications of these results for the global control of tuberculosis. Our results also reveal that occasionally a ""normal-virulence"" strain of M. tuberculosis can be expected to generate a large outbreak. We discuss the implications of these results in understanding the virulence of M. tuberculosis and in the planned elimination of tuberculosis in the United States.",28,1525-4135 (Print),437-44,NA,J Acquir Immune Defic Syndr
JOUR,article,915,Economic evaluation of universal BCG vaccination of Japanese infants,2001-01-01,"BACKGROUND: The international controversy surrounding the use and effectiveness of the Bacillus Calmette-Guerin (BCG) vaccine and the low incidence of tuberculosis (TB) among Japanese children prompted this study. METHODS: We compared 'universal BCG vaccination' with 'no vaccination at all' using a cost-effectiveness analysis. The study population was a hypothetical cohort comprising a total of 1.2 million infants born in 1996 at locations all over Japan. A model was developed to calculate the number of TB cases prevented by the vaccination programme. Assuming 40-80% overall vaccine efficacy (64-86% for TB-meningitis) and 10 years of protection, we calculated the cost and number of immunizations required to prevent one child from developing TB, the total number of TB cases averted by vaccination and total costs required for the programme. RESULTS: Based on an assumption of flexible vaccine efficacy (40-80%), we estimated that 111-542 TB cases including 10-27 of TB-meningitis would be prevented during the 10 years after BCG vaccination among the cohort of infants born in 1996. About US$35 950-175 862 or 2125-10 399 immunizations would be required to prevent one child from developing TB. Sensitivity analyses covering a wide duration of protection, incidence of TB, vaccine coverage and discount rate, revealed that other than vaccine efficacy, the cost of preventing a single case of TB is highly sensitive to the duration of BCG protection and TB incidence. CONCLUSION: The cost per case of TB prevented is heavily dependent on vaccine efficacy and the duration of protection, and is high compared with the cost of treating one child who has developed TB.",30,0300-5771 (Print),380-385,http://www.ncbi.nlm.nih.gov/entrez/query.fcgi?cmd=Retrieve&db=PubMed&dopt=Citation&list_uids=11369746,Int J Epidemiol
JOUR,article,955,The resurgence of tuberculosis in Russia,2001-01-01,"This paper documents and attempts to explain the epidemic spread of tuberculosis (TB) in Russia during the 1990s. After several decades of decline, the notification rate of all new TB cases among permanent residents increased by 7.5% per year from 1991-1999 and the death rate by 11% per year. Growth was quickest from 1993-1995 but increased again after the economic crisis of August 1998. Approximately 120 000 new cases and 30 000 deaths were reported in 1999. Case detection and cure rates have fallen in Russia since the mid-1980s; the fall has been accompanied by a higher frequency of severe disease among cases, and higher death and case fatality rates. With a mathematical model describing the deterioration in case finding and cure rates we could replicate the average rate of increase in incidence 1991-1999 but not the precise timing of the observed changes. Other factors that probably helped to shape the observed rise in caseload include enhanced transmission due to the mixing of prison and civilian populations, an increase in susceptibility to disease, and changes in the proportion of cases detected by surveillance. Although our explanation for the resurgence of TB is incomplete, we have identified a set of measures that can be implemented now to cut transmission, incidence and deaths.",356,0962-8436 (Print),1069-75,http://rstb.royalsocietypublishing.org.ez.lshtm.ac.uk/content/356/1411/1069.full.pdf,Philos Trans R Soc Lond B Biol Sci
JOUR,article,1e3,The effect of age and study duration on the relationship between 'clustering' of DNA fingerprint patterns and the proportion of tuberculosis disease attributable to recent transmission,2001-01-01,"Though it is recognized that the extent of 'clustering' of isolates from tuberculosis cases in a given population is related to the amount of disease attributable to recent transmission, the relationship between the two statistics is poorly understood. Given age-dependent risks of disease and the fact that a long study (e.g. spanning several years) is more likely to identify transmission-linked cases than a shorter study, both measures, and thus the relationship between them, probably depend strongly on the ages of the cases ascertained and study duration. The contribution of these factors is explored in this paper using an age-structured model which describes the introduction and transmission of M. tuberculosis strains with different DNA fingerprint patterns in The Netherlands during this century, assuming that the number of individuals contacted by each case varies between cases and that DNA fingerprint patterns change over time through random mutations, as observed in several studies. Model predictions of clustering in different age groups and over different time periods between 1993 and 1997 compare well against those observed. According to the model, the proportion of young cases with onset in a given time period who were 'clustered' underestimated the proportion of disease attributable to recent transmission in this age group (by up to 25% in males); for older individuals, clustering overestimated this proportion. These under- and overestimates decreased and increased respectively as the time period over which the cases were ascertained increased. These results have important implications for the interpretation of estimates of the proportion of disease attributable to recent transmission, based on 'clustering' statistics, as are being derived from studies of the molecular epidemiology of tuberculosis in many populations.",126,NA,43-62.,http://www.ncbi.nlm.nih.gov/htbin-post/Entrez/query?db=m&form=6&dopt=r&uid=11293682,Epidemiol Infect
JOUR,article,1014,A model to predict cell-mediated immune regulatory mechanisms during human infection with Mycobacterium tuberculosis,2001-01-01,"A key issue for the study of tuberculosis infection (TB) is to understand why individuals infected with Mycobacterium tuberculosis experience different clinical outcomes. Elaborating the immune mechanisms that determine whether an infected individual will suffer active TB or latent infection can aid in developing treatment and prevention strategies. To better understand the dynamics of M. tuberculosis infection and immunity, we have developed a virtual human model that qualitatively and quantitatively characterizes the cellular and cytokine control network operational during TB infection. Using this model, we identify key regulatory elements in the host response. In particular, factors affecting cell functions, such as macrophage activation and bactericidal capabilities, and effector T cell functions such as cytotoxicity and cytokine production can each be determinative. The model indicates, however, that even if latency is achieved, it may come at the expense of tissue damage if the response is not properly regulated. A balance in Th1 and Th2 immune responses governed by IFN-gamma, IL-10, and IL-4 facilitate this down-regulation. These results are further explored through virtual deletion and depletion experiments.",166,0022-1767 (Print) 0022-1767 (Linking),1951-1967,http://www.ncbi.nlm.nih.gov/pubmed/11160244,J Immunol
JOUR,article,613,Directly observed treatment for multidrug-resistant tuberculosis: an economic evaluation in the United States of America and South Africa,2001-01-01,"OBJECTIVE: To estimate the cost-effectiveness of directly observed treatment compared to conventional therapy in reducing the spread of multidrug-resistant tuberculosis, for an industrialised country (represented by the United States of America) and a developing country (South Africa). METHODS: Monte Carlo analysis using published data on probability, cost and health impact. RESULTS: In both countries, directly observed treatment is the dominant strategy, yielding cost savings and improved health outcomes. Cost savings for directly observed treatment relative to conventional therapy become more significant as more expensive second-line drugs are used in treatments. CONCLUSIONS: The cost-effectiveness of directly observed treatment relative to conventional therapy is demonstrated for both the USA and South Africa. Cost savings are more pronounced (especially for South Africa) as the likelihood of multidrug-resistant tuberculosis increases and more expensive second-line therapies are used. Given that health care resources are more severely constrained in developing countries, the data contained in this study are useful in guiding the design of policies for the effective management of multidrug-resistant tuberculosis in settings with limited resources.",5,1027-3719 (Print),1137-42,NA,International Journal of Tuberculosis and Lung Disease
